{
  "orderId": "ORD-2026-0001",
  "orderDate": "2026-06-23",
  "sourceSystem": "web-store",
  "salesChannel": "online",
  "currency": "usd",
  "paymentMethod": "credit_card",
  "couponCode": "SUMMER26",
  "discountAmount": 5,
  "shippingFee": 4.5,
  "taxAmount": 6.5,
  "priority": "high",
  "orderStatus": "confirmed",
  "customer": {
    "customerId": "CUS-00098765",
    "firstName": "Duy",
    "lastName": "Nguyen",
    "email": "duy@example.com",
    "phone": "+84 900 000 000",
    "address": "Ho Chi Minh City, Vietnam",
    "loyaltyLevel": "gold",
    "birthDate": "1994-04-12",
    "gender": "male",
    "companyName": "Example Trading",
    "taxNumber": "TAX-123456",
    "countryCode": "vn",
    "city": "Ho Chi Minh City",
    "postalCode": "700000",
    "marketingOptIn": true,
    "loyaltyPoints": 2400,
    "vipSince": "2024-01-15"
  },
  "items": [
    {
      "sku": "SKU-001",
      "itemName": "USB-C Hub",
      "quantity": 2,
      "unitPrice": 25.5,
      "category": "electronics",
      "brand": "Brand-A",
      "weightKg": 0.25,
      "giftWrap": true,
      "warehouseCode": "WH-01",
      "note": "Deliver before lunch and call customer when arriving",
      "color": "space gray",
      "size": "M",
      "material": "Aluminum",
      "originCountry": "cn",
      "barcode": "893000000001",
      "serialNumber": "SN-USB-001",
      "warrantyMonths": 24,
      "fragile": false,
      "expiryDate": "2028-12-31",
      "supplierCode": "SUP-A"
    },
    {
      "sku": "SKU-002",
      "itemName": "Garden Light",
      "quantity": 3,
      "unitPrice": 12,
      "category": "garden",
      "brand": "Brand-B",
      "weightKg": 1.2,
      "giftWrap": false,
      "warehouseCode": "WH-02",
      "note": "Leave at reception",
      "color": "warm white",
      "size": "L",
      "material": "Steel",
      "originCountry": "vn",
      "barcode": "893000000002",
      "serialNumber": "SN-LIGHT-002",
      "warrantyMonths": 12,
      "fragile": true,
      "expiryDate": "2027-06-30",
      "supplierCode": "SUP-B"
    }
  ],
  "totalAmount": 87
}
